[
  {
    "name": "API.Bible",
    "operator": "American Bible Society",
    "signup": "Account, app approval, and API key",
    "free_tier": "Starter: $0; open-access Bibles plus up to 3 selected copyrighted Bibles; non-commercial",
    "premium_cost": "Pro from US$29/month; commercial per-translation licences publicly start around US$10/month",
    "premium_required_when": "Any monetised use or licensed copyrighted edition required for commercial use",
    "caveats": [
      "500 consecutive verses/request",
      "free tier forbids ads, subscriptions, freemium and in-app purchases",
      "copyrighted content cannot train generative AI/LLMs without written consent",
      "cached content must be refreshed at least every 30 days",
      "commercial NIV is unavailable through its published plan"
    ],
    "sources": [
      "https://api.bible/",
      "https://api.bible/terms-and-conditions",
      "https://docs.api.bible/api-reference/getting-started/"
    ]
  },
  {
    "name": "ESV API",
    "operator": "Crossway / Good News Publishers",
    "signup": "Free account and API key",
    "free_tier": "Free for qualifying non-commercial use",
    "premium_cost": "No public API price; contact Crossway for expanded commercial licensing",
    "premium_required_when": "Commercial or beyond-standard use",
    "caveats": [
      "500 verses/query, cache, and display maximum",
      "5,000/day; 1,000/hour; 60/minute",
      "copyright notice and ESV.org link required",
      "text cannot be modified",
      "Crossway can revoke access"
    ],
    "sources": [
      "https://api.esv.org/",
      "https://api.esv.org/docs/"
    ]
  },
  {
    "name": "NLT API",
    "operator": "Tyndale House Publishers",
    "signup": "No key for limited anonymous access; API key for higher limits or to request commercial use",
    "free_tier": "Non-commercial anonymous access: 50 verses/request and 500 requests/day; key-based non-commercial access: 500 verses/request and 5,000 requests/day",
    "premium_cost": "No public self-service commercial price",
    "premium_required_when": "Commercial or expanded use",
    "caveats": [
      "Anonymous access is limited to 50 verses/request and 500 requests/day",
      "500 verses/request and 5,000 requests/day documented for key-based access",
      "copyright quotation limits still apply"
    ],
    "sources": [
      "https://api.nlt.to/",
      "https://sites.tyndale.com/nlt/"
    ]
  },
  {
    "name": "NET Bible API",
    "operator": "Biblical Studies Press / Bible.org",
    "signup": "None",
    "free_tier": "Free passage API",
    "premium_cost": "No published tier; commercial rights require permission",
    "premium_required_when": "Commercial publication or product use beyond copyright terms",
    "caveats": [
      "Underlying NET text is copyrighted",
      "passage lookup only; no documented rate limit",
      "follow NET copyright terms"
    ],
    "sources": [
      "https://labs.bible.org/api_web_service",
      "https://netbible.com/copyright/"
    ]
  },
  {
    "name": "Bible Brain",
    "operator": "Faith Comes By Hearing",
    "signup": "API-key application with intended-use details",
    "free_tier": "Free for qualifying non-commercial access",
    "premium_cost": "No public price; contact FCBH",
    "premium_required_when": "Commercial, restricted-content, or special licensing needs",
    "caveats": [
      "end users must receive content free by default",
      "no proxy distribution network",
      "offline download is not generally permitted",
      "translation-specific upstream terms and faith guidelines apply"
    ],
    "sources": [
      "https://www.faithcomesbyhearing.com/bible-brain/developer-documentation",
      "https://www.faithcomesbyhearing.com/bible-brain/license"
    ]
  },
  {
    "name": "Digital Bible Library",
    "operator": "Digital Bible Library",
    "signup": "DBL account; organisation Account Manager generates an organisation-scoped DBL API key",
    "free_tier": "Open-access/public-domain/Creative Commons content",
    "premium_cost": "No public standard price; rights-holder agreements vary",
    "premium_required_when": "Controlled/copyrighted source content or organisation workflows",
    "caveats": [
      "licensing and content-management platform, not merely a passage API",
      "a DBL key proves the permissions of its organisation; it does not grant blanket access to the DBL catalogue",
      "open-access content is available to DBL members under its published terms; controlled content requires an active, rights-holder-approved agreement",
      "adding the DBL key to an API.Bible app exposes only DBL content items that the DBL organisation is permitted to use",
      "DBL key is a credential: do not expose it in a client app, repository, or chat"
    ],
    "sources": [
      "https://library.bible/",
      "https://care.library.bible/article/196-api-bible",
      "https://care.library.bible/article/208-controlled-access",
      "https://care.library.bible/article/198-exploring-our-public-api"
    ]
  },
  {
    "name": "Bible Gateway API",
    "operator": "HarperCollins Christian Publishing",
    "signup": "No public self-service process documented",
    "free_tier": "No public developer tier advertised",
    "premium_cost": "No public pricing",
    "premium_required_when": "Treat production access as partnership/licence-gated",
    "caveats": [
      "technical access-token documentation exists",
      "do not rely on web scraping",
      "confirm authorisation and rights in writing"
    ],
    "sources": [
      "https://www.biblegateway.com/api/documentation",
      "https://www.biblegateway.com/legal/terms/"
    ]
  },
  {
    "name": "Free Use Bible API",
    "operator": "AO Lab",
    "signup": "None",
    "free_tier": "No key or stated usage limits",
    "premium_cost": "None advertised",
    "premium_required_when": "Never, per published provider model",
    "caveats": [
      "retain and inspect the metadata/licence for each edition",
      "provider claims commercial and modification freedom; verify provenance for high-risk production decisions"
    ],
    "sources": [
      "https://bible.helloao.org/",
      "https://bible.helloao.org/api/available_translations.json"
    ]
  },
  {
    "name": "DailyBible API",
    "operator": "DailyBible",
    "signup": "None",
    "free_tier": "Free public-domain catalogue",
    "premium_cost": "None advertised",
    "premium_required_when": "Never for published public-domain editions",
    "caveats": [
      "small catalogue; not a broad licensed-translation provider",
      "be respectful with request volume"
    ],
    "sources": [
      "https://dailybible.ca/api-docs"
    ]
  },
  {
    "name": "YouVersion Platform",
    "operator": "YouVersion, Inc. / Life.Church",
    "signup": "Developer account, registered app, and App Key",
    "free_tier": "Platform describes its Bible tools as free; actual Bible collection follows accepted licence agreements",
    "premium_cost": "No public price published",
    "premium_required_when": "No public paid tier documented; publisher/version-specific licence agreements may be required",
    "caveats": [
      "Send X-YVP-App-Key with every request",
      "Bible collection is limited to versions available after relevant licence agreements are accepted",
      "do not create a competing/replicating service",
      "AI output to users requires prior written approval; do not train, develop, refine, or improve AI using the tools",
      "keep credentials confidential and enable built-in usage reporting"
    ],
    "sources": [
      "https://developers.youversion.com/",
      "https://developers.youversion.com/api-usage",
      "https://platform.youversion.com/terms"
    ]
  }
]
